_group,_name,_namespace,_qualName,_dc:relation,_dc:description,_comments,_examples,_required,_type,_thesaurus
Taxon,cultivarEpithet,http://rs.tdwg.org/dwc/terms/,http://rs.tdwg.org/dwc/terms/cultivarEpithet,https://dwc.tdwg.org/terms/#dwc:cultivarEpithet,"Part of the name of a cultivar, cultivar group or grex that follows the dwc:scientificName.","According to the Rules of the Cultivated Plant Code, a cultivar name consists of a botanical name followed by a cultivar epithet. The value given as the dwc:cultivarEpithet should exclude any quotes. The term dwc:taxonRank should be used to indicate which type of cultivated plant name (e.g. cultivar, cultivar group, grex) is concerned. This epithet, including any enclosing apostrophes or suffix, should be provided in dwc:scientificName as well.",`King Edward` (for scientificName `Solanum tuberosum 'King Edward'` and taxonRank `cultivar`); `Mishmiense` (for scientificName `Rhododendron boothii Mishmiense Group` and taxonRank `cultivar group`); `Atlantis` (for scientificName `Paphiopedilum Atlantis grex` and taxonRank `grex`),false,,
Taxon,taxonRank,http://rs.tdwg.org/dwc/terms/,http://rs.tdwg.org/dwc/terms/taxonRank,https://dwc.tdwg.org/terms/#dwc:taxonRank,The taxonomic rank of the most specific name in the dwc:scientificName.,"Recommended best practice is to use a controlled vocabulary. The taxon ranks of algae, fungi and plants are defined in the International Code of Nomenclature for algae, fungi, and plants (Schenzhen Code Articles H3.2, H4.4 and H.3.1).",`subspecies`; `varietas`; `forma`; `species`; `genus`; `nothogenus`; `nothospecies`; `nothosubspecies`,false,,http://rs.gbif.org/vocabulary/gbif/rank_2015-04-24.xml
Taxon,verbatimTaxonRank,http://rs.tdwg.org/dwc/terms/,http://rs.tdwg.org/dwc/terms/verbatimTaxonRank,https://dwc.tdwg.org/terms/#dwc:verbatimTaxonRank,The taxonomic rank of the most specific name in the dwc:scientificName as it appears in the original record.,,`Agamospecies`; `sub-lesus`; `prole`; `apomict`; `nothogrex`; `sp.`; `subsp.`; `var.`,false,,
Taxon,scientificNameAuthorship,http://rs.tdwg.org/dwc/terms/,http://rs.tdwg.org/dwc/terms/scientificNameAuthorship,https://dwc.tdwg.org/terms/#dwc:scientificNameAuthorship,The authorship information for the dwc:scientificName formatted according to the conventions of the applicable dwc:nomenclaturalCode.,,"`(Torr.) J.T. Howell`; `(Martinovský) Tzvelev`; `(Györfi, 1952)`",false,,
Taxon,vernacularName,http://rs.tdwg.org/dwc/terms/,http://rs.tdwg.org/dwc/terms/vernacularName,https://dwc.tdwg.org/terms/#dwc:vernacularName,A common or vernacular name.,,`Andean Condor`; `Condor Andino`; `American Eagle`; `Gänsegeier`,false,,
Taxon,nomenclaturalCode,http://rs.tdwg.org/dwc/terms/,http://rs.tdwg.org/dwc/terms/nomenclaturalCode,https://dwc.tdwg.org/terms/#dwc:nomenclaturalCode,The nomenclatural code (or codes in the case of an ambiregnal name) under which the dwc:scientificName is constructed.,Recommended best practice is to use a controlled vocabulary.,`ICN`; `ICZN`; `BC`; `ICNCP`; `BioCode`,false,,http://rs.gbif.org/vocabulary/gbif/nomenclatural_code.xml
Taxon,taxonomicStatus,http://rs.tdwg.org/dwc/terms/,http://rs.tdwg.org/dwc/terms/taxonomicStatus,https://dwc.tdwg.org/terms/#dwc:taxonomicStatus,"The status of the use of the dwc:scientificName as a label for a taxon. Requires taxonomic opinion to define the scope of a dwc:Taxon. Rules of priority then are used to define the taxonomic status of the nomenclature contained in that scope, combined with the experts opinion. It must be linked to a specific taxonomic reference that defines the concept.",Recommended best practice is to use a controlled vocabulary.,`invalid`; `misapplied`; `homotypic synonym`; `accepted`,false,,
Taxon,nomenclaturalStatus,http://rs.tdwg.org/dwc/terms/,http://rs.tdwg.org/dwc/terms/nomenclaturalStatus,https://dwc.tdwg.org/terms/#dwc:nomenclaturalStatus,The status related to the original publication of the name and its conformance to the relevant rules of nomenclature. It is based essentially on an algorithm according to the business rules of the code. It requires no taxonomic opinion.,,`nom. ambig.`; `nom. illeg.`; `nom. subnud.`,false,,http://rs.gbif.org/vocabulary/gbif/nomenclatural_status_2019-02-08.xml
Taxon,taxonRemarks,http://rs.tdwg.org/dwc/terms/,http://rs.tdwg.org/dwc/terms/taxonRemarks,https://dwc.tdwg.org/terms/#dwc:taxonRemarks,Comments or notes about the taxon or name.,,`this name is a misspelling in common use`,false,,
