_group,_name,_namespace,_qualName,_dc:relation,_dc:description,_examples,_required
Preparation,preparationType,http://data.ggbn.org/schemas/ggbn/terms/,http://data.ggbn.org/schemas/ggbn/terms/preparationType,http://terms.tdwg.org/wiki/ggbn:preparationType,"Description of preparation type (specimens, tissues, DNA)","for DNA: gDNA; for tissues/specimens: leaf, muscle, leg, blood",true
Preparation,preparationProcess,http://data.ggbn.org/schemas/ggbn/terms/,http://data.ggbn.org/schemas/ggbn/terms/preparationProcess,http://terms.tdwg.org/wiki/ggbn:preparationProcess,"Process used in preparing the specimen or sample, can also be used to describe Phage/Plasmid propagation, Process used in extracting the DNA/RNA; adaptions made; SPREC code",,false
Preparation,preparationMaterials,http://data.ggbn.org/schemas/ggbn/terms/,http://data.ggbn.org/schemas/ggbn/terms/preparationMaterials,http://terms.tdwg.org/wiki/ggbn:preparationMaterials,"Materials and chemicals used in the preparation of the specimen, tissue, DNA or RNA sample","for DNA: DNeasy blood and tissue kit, CTAB;",false
Preparation,preparedBy,http://data.ggbn.org/schemas/ggbn/terms/,http://data.ggbn.org/schemas/ggbn/terms/preparedBy,http://terms.tdwg.org/wiki/ggbn:preparedBy,Person and/or institution responsible for or effecting the preparation/extraction,"Jane Doe, NMNH",false
Preparation,preparationDate,http://data.ggbn.org/schemas/ggbn/terms/,http://data.ggbn.org/schemas/ggbn/terms/preparationDate,http://terms.tdwg.org/wiki/ggbn:preparationDate,The date of preparation/extraction,2011-01-18,true
Occurrence,associatedReferences,http://rs.tdwg.org/dwc/terms/,http://rs.tdwg.org/dwc/terms/associatedReferences,http://rs.tdwg.org/dwc/terms/associatedReferences,"A list (concatenated and separated) of identifiers (publication, bibliographic reference, global unique identifier, URI) of literature associated with the Preparation.",,false
